<?xml version="1.0" encoding="UTF-8"?>
<ConfigWrapper xmlns="http://s8.com" xmlns:xsi="http://www.w3.org/2001/XMLSchema-instance"
	xsi:schemaLocation="http://s8.com mg-schema.xsd">
	<silicon>
		<T1-unit n-threads="6">
			<map profile="WEB_REQUEST_PROCESSING">0, 2, 3</map>
			<map profile="WEB_REQUEST_SELECTING">1</map>
			<map profile="FILE_WATCHING">5</map>
			<map profile="IO_LOCAL_DISK">4</map>
			<map profile="FX0">1</map>
		</T1-unit>
	</silicon>
	<magnesium>
		<root-path>/Users/pc/qx/git/com.s8.arch.magnesium/data</root-path>
	</magnesium>
</ConfigWrapper>